Comment,Bully
bagus dong cari ilmu kapan mana itu karena suami orang didik,0
sukses terus kak ayu dan moga selalu senantiasa dalam naung allah subhanahu wa taala dan sehat selalu amin,0
nama ah kata jaga ucap lah ucap dia tidak jaga sendiri dasar munafik dasar betina zaman now ellu kali yang lebih micin kamu sendiri otak kamu kan di selangkang mana paham moga tuhan ampunin munafik kamu cun,1
nama bisa nya cuma maki orang sindir siapa warganet goblok banyak masyako,1
yesssssss bagus banget kids jaman now yang begini yang diksh jempolllll,0
banding lagu go internasional yang paling kena di gue ini seru enak dengar tapi tumben agnes tidak beri bumbu indonesia kayak ada batik begitu atau apa,0
keren suara bagus,0
munafik banget yang bicara curhat di media sosial kampung gue yakin kamu juga kitu keleusss wkkwkww mending mbak via dia a is cantik bisa nyanyi lah kamu pada lebih kampung wkwk,1
kasihan anak jangan sampai anak rusak juga kayak emaknya ya,0
kalau kita bisa menga ikan jodoh ini lah yang di bilang jodoh cantik lahir batin tapi kalau tidak jodoh pisah yang baik,0
alhamdulillahhh ada juga yang ngepost ayangnya ibel biar deh damai isi dunia masing masing sudah punya pasang jadi tidak ada lagi yang bilang ibel pho happy b day ibel,0
nama lah goblok amat tidak semua warganet yang kontra sama postingan sih via ini bakajaer kali mbak mas ih goblok kok pelihara wkwk,1
sedih ya sekarang amen di kawin orang mantan istri mah naik pesawat jet selamat tinggal rebut laki orang dan botakbego,1
dear bapak nama cra berpakain bapak sangat lah cermin pribadi bapak yang sangat lembut tetapi tetap gagah moga bapak nama keluarga selalu dalam lindung allah subhanahu wa taala salam hormat dari saya yang selalu kagum bapak,0
cewek manis cakep yang sekarang dari yang kemarin tidak jadi,0
hahhahaha dan sungguh allah subhanahu wa taala laknat wanita rebut dan zina dengan suami sah oranglain,1
nama bisa nya cuma maki orang sindir siapa warganet goblok banyak masyako,1
nama iya kasihan sih micin padahal usah produk micin iklan kan kalau masak tambah micin biar tambah sedap warganet sudut micin olah semua bodoh orang yang punya ganggu jiwa ngemil micin justiceformicin,1
ganteng yesss mami cocok deh sama babang moga langgeng ya unchhh lope mami,0
asa kayak mau manggung kakak nama moga lancar dan cepat punya momong biar ada princess kecil momo atau tidak prince,0
cuma orang govlok yang percaya ayu slgkuh sama rafi bukti rafi sama gigi sekarang baik baik saja dan ktamu ayu itu rebut laki orang suami siapa yang di rebut oi sekarang ayu punya suami pikir pakai otak makanya jangan banyak micin kan jadi govlok,1
ini mau nikah lagi baguass deh moga kelak jadi keluarga yang samawa,0
jangan di dengar kata 2 yang sakit hati lebih baik tenang janani saja dengan pilih andah sendiri bahagia itu biasa ada di kata hati maju terus dan sukses sama pasang mu,0
apa kerja yang penting halal kamu untuk nafkah keluarga semangat pak,0
gilaaaaa rebut laki orang banyak banget laki laki gatal juga banyak alas untuk poligam woiii pikir pakai otak aduh saya pikir dia orang pintar tau agama mana baik mana buruk allah uji setia dan nafsu eh malah kayak begitu sakit istri sama saja tutup pintu rejekimu anak istri kamu korban bagai orang imam keluarga dia telah gagal mmpe ahankan rumah tangga coreng nama baik nya sendiri semua orang suka sekarang benci sama dia sama,1
raisa cantik ya meski a is tapi tidak tonjol kalau nikah itu harus mewah sudah cantik sederhana sempurna banget,0
dadddd moga bisa datang ya untuk papa papa di luar sana moga sehat selalu bisa jadi saksi anak anak saat meni amin,0
keren yang penting punya bakat dulu nanti juga kalau sudah jadi a is banyak duit muka bisa cemerlang,0
iya ampun pnyanyi dangdut kurang tenar songong banget bacot ingin cari sensasi tapi kmpungan banget deh amit amit bool kok di instagram story,1
salut sama bunda nama meski ibu sambung tetapi sellu jadi orang yang plingbdpan bela aurel dan azriel dari pra hater,0
wkwk sudah tidak laku lagi jadi nyanyi dhajatan sih lonte rebut laki orang,1
muljem bicara tidak jelas blepot tidak sadar mau hidup enak saja pakai rebut laki orang dulu,1
nama itu urus itu kuin kamu biar tidak gatal nempel2 sama laki orang masyarakat sudah tau kali japok gundik janda gatal sudah nyata nya begtu kata anak sholehah agama nya kuat tapi mata kuliah agama cuma dapat 1 kata agama nya kuat tetapi hamil di luar,1
ini cwenya yang bego apa cwonya yang pintar ya memang laki kayak atau macho atau apa begitu plus nya seperti cuma jago gombal atau main gesit ulala ngakakabis,1
jelek lecek bantat,1
nama hahahaaaa terus gue tanya kamu tolol pakai tanya kador bencong atau tidak padahal belum kenal wkwk eh semua orang juga bisa nilai sih kador bencong benar dari gerak gerik melambay suara ngondek dan pakai baju cewek begitu nyaman mana ada cowok itu,1
yaela muljem seperti situ benar saja enggak ingat apa sudah rusak kbhagian klwrga orang bego di p ahanin iya begini ini,1
benar kata pepatah yess buah jatuh tidak jauh dari pohon nya cantik nya dapat dari mama nya suara bagus dan pintar nyanyi dari darah seni papa nya calon generasi hebat di masa depan,0
moga saja nikah lancar iya mb jangan larut sedih kalau bapak tiri tidak datang yang penting bapak kandung datang mungkin saja ada alas anak kandung dari bapak sebut larang mungkin saja bapak itu sudah balik sama istri pe ama dan kalau sibapak datang itu ber i akan ingat cerita lama mungkin ya,0
edit banget itu ya ampun sih mama lambe habis gosib ya buat sih rebut laki orang,1
coba lihat bibir mu sayang sepe i pantat ayam wajah mu bulu sepe i kentut perfectoooo,1
biar puas puas mumpung deseu masih asa muda nanti kalau sudah tua juga nyaho karma itu ada,1
biasa balajaer sampah di instagram para a is suka suka yang punya instagram lah mau bikin caption apa kok balajaer yang heboh dan asyik ceramahin yang punya instagram tar lama lama di buat lagu sama teh melly lah balajaer yang judul ketika balajaer sabda demi seonggak koin laknat nya balajaer amuk bera i iya banget koin laknat nya jadi goda di nya gigi aduh alah balajaer kami semua tau kali laku biduan kamu itu kayak apa minus segala gala lagi masih di bela mati mati pada sakit jiwa,1
muantepp ganteng selamat tempuh hidup baru mg langgeng rumah tanggax bahagia dan selladem ayem,0
salut sekali banting tulang demi hidup keluarga yang duduk di bangku empuk pakai ac malah rampok yang pilih rakyat jelata lagi,0
bukankah jedun yang tidak becus jadi perempuan hormat tidak becus jadi perempuan cerdas tidak becus jadi perempuan yang cari suami sah bukan suami orang tidak becus jadi perempuan yang hindar narkoba tidak becus jadi perempuan yang jaga nama baik keluarga moga hanya ada satu perempuan yang kayak kamu di dunia ini ya jedun,1
yatuhan suaranyaaaaaaa bagus bangetttttttt,0
gagah kali abang borisq ini kalau tidak baca nmx benar benar tidak tau kalau it bang bor,0
nama aurel itu cantik tau pernah lihat asli nya kok orang sirik itu yang jelek jelek padahal muka sendiri belum tente lebih cantik dan muda daripada aurel aurel foto tampak putib bilang suntik putih lihat hitam bilang tidak bisa ra,0
mbak dewi jadi lebih sabar keliahatannya keren moga makin langgeng,0
lebih keren dari nyanyi asli,0
gue lina2706 nama lucu saja ya sist lonte di bela bela mati mati goblok di pelihara di bayar berapa begitu sama muljamban sampai bikin account nama mau maia nikah atau belum nikah apa urus situ lihat nyinyir sirik nya sekarang balik,1
nama ini lagi pikir manusia bodoh eh tante ibu oma empo otak kamu picik banget ya dia juga manusi biasa ada larang memang di dunia ini orang di larang ngungkapin unek2 bodoh human,1
geblek kamu tata cowok banget dibela2in balik hadeww nanti tinggal lagi salah itu cowok padahal kitenya yang beloon,1
sih amanda muka ke tante umur baru berapa tetapi muka boros banget dasar cabe jujur gue adalah tidak suka sama nih haltis,1
coba deh yang pada kritik2 itu bikin karya sendiri siapa tau lebih bagus dari yang mereka kritik,0
cantik banggeett ya kak depe tidak lihat lah kalau dia pernah nikah sepe i masih gadis wajah nya cantik moga lancar sampai hari h kak depe bahagia dunia akhirat aammiinnn,0
motorninja saja songong amat mbak orang yang punya mobil lamborgini saja biasa saja kok,1
moga tidak putus lagi ya kakak bella sudah bahagia banget itu tidak malu,0
keren padahal nyanyi santai banget,0
sumpah gue suka banget sama lagu dia yang ini asyik banget di dengernyaa,0
si lonte ini bukan sensasi ngjak ribut orang mulu sampah,1
weewww bangga kali aku lihat bang nama pakai baju adat sama syip,0
heran gue mak nama kenapa dia masih saja di pakai sama an v di pesbu r kasus nya bederet skandal be ubi2 tidak ada malu nya muka tembok sangat tidak ada faedah nya tonton acara yang ada sih manusia kardus ini,1
ya benar tidak akan ubah pandang tuhan hadap kita utama kamu setan makanya mikirrrr suami majikan kok embat,1
yang kecil lucu yang tengah ganteng parah yang gede pintar tidak ketulungan salam hormat saya bu pak,0
keren ya sederhana pancar jelas suka sama keluarga presiden ini,0
bunda maia cantik moga selalu sukses sehat terus ya cantik wajah cantik hati,0
cewek cantik the power of tajir,0
waduuhhh keren banget dedek2 emeesh,0
suka banget sama pasang satu ini moga gigi dan raffi jadi keluarga sakinnah mawaddah warrahmah moga tidak ada pihak2 yang ingin pisah mereka jodoh sampai maut pisah amin,0
nama dia sudah tunjuk karya situ punya karya apa karya nyinyir hidup via tolol,1
aurel itu perempuan hebat ingat banget jadi zaman pipi mimi nya lihat di depan mata dia sendiri tidak semua anak bisa strong kayak dia yang nyinyir pasti iri karena aurel bisa punya keluarga bahagia kayak sekarang yang bilang bunda ash lebay mungkin belum punya anak hati hati sayang km juga perempuan nanti bakal jadi ibu bayang anak yang jadi korban bully,0
anyiennnnggg suara hancur banget lebih merdu tukang goreng,1
kalau pasang cantik ganteng suka deh lihat,0
nama euum tuju sekaliii memang cantik ini dari pada yang belum lebih wah baik pelihara hehe,0
nama justru karena kakak bella sholehah punya hasil sendiri dan cantik jadi allah mau kasih jodoh yang lebih baik lagi,0
mbak bela nikah dasar atas dasar agama mbak yang utama ya biar laki2nya dapat yang baik saya yakin banyak laki laki yang baik dan kayak raya yang mau nikah mbak,0
nama wawan zzzzz memang ini a is tidak punya teman apa sedikit sedikit att haha lagi juga apa apa curhat di media sosial kampung,1
sih wanita jahiliyah lesbi sekarang sudah py pacar lagi kasihan anak kemarin di kasih bencana slnya dia tega misahin anak dari bapak nya dia ktakutan anak nya masuk islam padahal bapak nya tidak pernah tuntut anak peluk islam sudah di kasih nikmat anak 3 orang masih saja begajulan,1
gue suka gange i deh ya kenapa kalau via vallen bikin status atau apa itu sangkut pautin sama att mulu padahal att nya saja biasa saja fannya sih yang bikin jelek orang kalau di sangkut pautin mulu juga lama lama gerah kali,1
he anak bangsat babi pesek buruk rupa keriting ingin penggal leher kamu sampai putus lumayan buat makan buaya,1
ingin tahu juga sama nyonyiah kamu jongos nama memang tetehlu pas hamil peak sudah dinikahin brojol anak baru di sirih memang lonteeeee kelas akun jamahliur dan junjung hehe,1
cantik banget ya punya anak cewek begini puyeng kali ya jaga nya,0
nama iya aku sih jujur bukan fan nia biasa saja sama dia pas dia tenar banget sama sinteronnya juga aku biasa saja tapi makin ke sini kalau soal urus keluarga aku salut sama dia dia kan masih muda ya itungannya sama aku cuma beda 2 3 t,0
gojek itu mayoritas pegangguran yang lama tidak kerja terus hampir putus asaa tapi tiba tiba ada lapang kerja yang tidak harus pakai ijazah akhir ini sungguh lapang kerja yang sangat bantu sekali turut saya,0
nama oalaahhh makin banyak saja rebut laki orang laki nya juga kegatelan tetapi nama laki ibarat kucing di kasih ikan jaer gratis ya tidak tolak wkwk,1
nama please kamu jangan bela rebut laki orang ini semua hukum untuk sih muljem karena sudah tega recut suami sahabat sendiri dia lagi jalan sanksi sosial kenapa valakor mesti benci karena biar tidak ada valakor lain di indonesia biar musnah sem,1
mbak nama kalau kamu tidak rasa cinlok sama babang anthony terus kalian awal ketemu mana sih di sinetron boy kan alah aku saja bera i kan mbak dumang cinlok jangan sok sok bilang tidak cinlok itu nama bodoh wajar dong warganet bilang ratu cinlok nyata memang ya kan jangan marah risiko jadi a is hahahhaa pintar pintar ya mbak kalau mau cari alas haha,1
najis ini baru muakk jijik rebut laki orang jijik,1
lucu suara kak abbey cantik kayak orang nya haru,0
cewek yang begini yang harus gosong jadi abu saja di bakar pabrik yang lagi viral kemarin itu benar benar selain tidak brguna enggak ada otak cuma modal kangkang terus gebet laki orang terus bangga by the way kalau memang instagram story nya buat sindir bin tua adalah eh at least biar tidak becus jadi prewi tetapi becus cuii jadi emak bukti anak nya bejibun terus semua pro ke emaknya daripada bapak,1
aku percaya kak nik orang jujur semangat kak nik hebat,0
ikut bangga pasti,0
masa allah suara bagus banget cantik lagi orang idam semua cowok,0
syarat sah nikah turut agama islam hanya 5 yaitu ada cpp ada cpw saksi wali nikah dan mas kawin mahar perkara makeup tidak manglingi bukan syarat sah nikah sekalipun tidak makeup tapi syarat yang 5 sebut penuh maka nikah sah ya emak emak julids,1
doa istri dan anak menye aimu bang lelaki yang be anggung jawab itu sangat perlu karena kalau laki laki tanggung jawab otomatis dia akan sayang dengan anak dan istri beda dengan sayang yang belum tentu be anggung jawab,0
a is yang gue kaguminn nikah muda tidak banyak mau sayang keluarga sayang suami utama anak anak tidak puyeng sama dunia hibur dan ke a isann padahal tajirrr mampus plus tidak alay dan tidak aneh aneh salutt sama niaa smiga selalu samawa ya nia and famzz,0
proud of kamu kak dea sangat patut bangga,0
bagus daripada beberapa a is yang modal tampang doang padahal suara juga jelek lebih baik mas ini yang nyanyi memang dasar nasib orang ya tidak ada yang tau moga mas bisa sukses,0
nama alycia iya sist jijik banget gue lihat sok suci maki orang kalau gue sih malu a is papan atas tapi otak tidak di pikir kalau bicara tahu banget tidak ada wibawa kalau memang dia sadar dia siapa harus dia tau cara komentar manusia tidak ada yang,1
mbak acha cantik banget banget banget buat calon ibu yang belum di kasih momong sama allah moga di segera ya,0
norak benar gaet jahat baru rasa,1
aduh geulis kitu tinggal sama yang itu duuuhhhh haha jodoh pasti allah kasih yang lebih baik teeeh,0
pnyanyi dangdut yang tidak kelas begini nih bukan iya nonjolin suara malah nonjolin dada,1
salah fokus ke muka sumpah jelek operasi plastik apa model begitu failed,1
keren banget suara tinggal permak saja biar tambah cantik viralkann,0
pernah tidak mbak nama baca ada warganet yang sesal tidak bisa timpuk telur ke sih mulan gue saja tertawa baca karena wakil ya apa buang buang waktu ketemu orang tidak mutu dengan sih mulan masih untung nyempet2in bisa nuli di sini biar sadar itu rebut laki orang tidak punya harga diri mending ketemu orang baik baik surat pemberitahuan tahun bunmai tular aura positif,1
cantik senyum mirip maudy kusnaedi,0
lcb cantik sangat lcb untung dapat duren dan duren pun beuntung dapat neng lcb sakina mawaddah warahmah amin,0
suka banget sama pidatox dia cara pembawaanx begitu elegan dan brwibawah pantas memang dia mdptkan salut,0
lemas ya mulut berani lewat ststus sudah begitu tulis sengaja biar tidak baca takut kali di labrak mmmm a is masih kampung sih ya jadi wajar lah ya,1
nama suami saya umur sama saya mbak malah tua saya beberapa bulan tapi alhamdulillah suami saya tidak kekanak kana hehe,0
polossss keren tidak banyak mau kayak jossss,0
eh jongos coba gue lebih dahulu yang tanya sama kamu memang nyonyiah ada gembar gembor sudah nikah ada nyonyiah aku sudah nikah dari pada tetehlu yang lonte perek itu tiba brojol dan aku nikah siri sama laki nyonyiah dan hamidun sapeak anak ilegal dibilng fitna keji haha lonte tolak lupa xixix nama,1
susah otak diemvang adalah bikin rusuh lapak orang,1
jablay anjir muka murah banget najisss,1
lama lama ilfeel deh sama nih e ong caption instagram cerita nya bicara orang malu orang kan jadi ambigu nilai sih a sih b sih c sudah begitu kayak paling di zalim salahinnya depan lawan dong jangan bicara di status ah kata nya dewasa,1
ayu janda bego punya suami kapan nikah lagi,1
muka mirip insya allah jodoh dunia akhirat mbak nama amiiii,0
nama siapa bilang gue fannya via aduh tantang gue nih orang anak tolol anak alay jablay,1
mbak via seperti siyok lihat kejam dunia per a is an mudah mudah tetap sabar tetap karya dengan baik,0
astagah suka sama cewek dekil mel ibarat dari nagita turun ke att nagita kayak emas att kayak barlen,1
nama sini gue jawab currr ya bunmai sudah pernah nikah tetapi sekarang janda dia janda karena suami nya di rampas mulan jameela jijik banget ya mulan jameela belum rumah tangga bunmai hancur sudah berani bilang dan suami sama aduha sudah wanita be,1
cuma jual goyang ya suara macam tai,1
smnjk habis nikah aura keluarr banget suami juga lihat sayang dan nia nya lihat baik begitu tulusss suka deh lihat,0
inti kalau kesal dengan att nya tidak usah ke anak juga kasihan buat kembang psikis anak depan itu orang benar benar tolol sekarang anda dia punya anak terus anak ejek sama orang yang benci sama dia bagaimana asa dia benci sama orang boleh tapi harus tau batesnya toh nama manusia gaakan semua jadi suka pasti ada hater,1
nama ya ampun ini upil naruto kata kata makin cermin kalau dia yang benar pecun alam banget kamu ya kasihan gue jadi prihatin mati saja deh kamu kotor dunia manusia macam kamu,1
moga selalu di ikan sehat dan panjang umur ya nek muda banget cantik dan mashaallahhh,0
orang edan nih orang sudah makan uang rakyat tidur pula,1
dari kisah jevin radhini rini gue jadi ajar 1 hal kalau memang jodoh maka akan ada saja jalan gue betul ikut dari awal gue tonton pas live the remix jevin bicara itu pacar saya tonton sambil tunjuk radhini gue juga tonton pas jevin peluk radhini erat banget di back stage telah lolos ke final lihat jevin ini anak gentle tulus dan sayang tapi allah maha bolak balik hati mei 15 jevin radhini pacar september 15 jevin rini pasang the remix desember 15 final the remix jangan 16 jevin radhini putus februari 16 jevin rini pacar april 16 jevin ngelamar rini februari 17 jevin rini tunang mei 17 jevin rini nikah allah works in many arah allah si plan is better tahan our plan jevin yang dulunya berfikiran akan nikah umur 30 siapa sangka di umur 25 dan dalam waktu pacar baru 2 bulan sudah yakin ajak anak orang nikah ah happy wedding soundwave bahagia selalu,0
nama main main lah ke jawa timur biar tidak bego,1
jijik lihat sumpah deh minceeee,1
ya admin nya masuk golong konsumsi micin dan pil pcc otak kamu rusak min,1
cantik alami tanpa perlu bedak tebal dan gaya bak tante tante,0
pantas saja di tinggal laki ya laki juga pikir kali kalau perempuan kayagni urus diri saja dia tidak becus bagaimana urus anak mending anak sama ayah nya saja benar didik,1
nama iya kakak haha geli banget enggak sih sama att ih kampung habis,1
ini siapa sih memang a is kok a is indonesia bukan nya urus prestasi malah di media sosial nya begini mulu isi nya jadi jatuh nya kampung,1
bencong rombeng jijik gay juga,1
he orang goblok juga bisa beda vape shisha sama rokok jelas jelas kamu rokok pakai acara tidak aku segala,1
pada protes kenapa sih yang protes itu coba usaha deh jangan kira usaha dia pendek ya butuh waktu lama dia agar bisa go international jangan cuma protes kalau ingin yang kalian ingin ya kaliam sendiri dengan cara sendiri agar kalian bisa go international,0
proud of kamu indonesia god bless indonesia,0
ya ampun lakikny ganteng rini nya juga cantik mungil pula sekarang,0
orang gila itu ingin hitz cari tenar rela di penjara cari sensasi ting supaya beken sampai hina hina orang astagfirullah kaya apa sih orang kayak mulut nya ky sampah tidak sekolah ya,1
begitu laki laki ya sis lebih suka pecun2 murah daripada perempuan baik baik jilbab atau pintar enji2 kok downgrade sih dari dangdut naik kelas perempuan jilbab eh pilih sama pecun lagi jelek selera,1
tidak united state of america pakai anjing babi kalau gue balas begitu wkwk,1
editanx paraaaahh operasi plastik saja laaah nyai daripada ngedit2 begini haha kan malu,1
mb depe langgeng iya sama masny mb ibu gari banget sama mb depe dari mb sama mas saiful dulu smpe2 bilang jadi pembntuny gapapala kata ingin banget ketemu mb depe ibu kami dijambi mb,0
nama bego kamu ya,1
anjing nya amuk hidup kok dmana2 punya musuh sudah lihat mana yang baik dan bukan orang baik tidak punya banyak musuh,1
susah kalau a is kampung,1
dan lagi ada yang masih bawa bawa keenan raisa sudah paling bahagia ngedapetin suami yang super ngemong dan mature kayak hamish raisa itu cukup dewasa di banding wanita umur yang masih pikir diri sendiri jadi turut gue raisa dan hamish sama sama untung bisa jadi pasang suami istri tidak ada itu gagal pindah on sok congratz raisa dan hamish moga nikah sakinah mawadah dan warahmah,0
nama heeehh kamu pelakornya yaaaakkk kenapa kamu jadi emosi situuu kenal gue kalau berani pakai akun asli dong pantas pakai akun bodong rebut laki orang juga diam diam ceplos ya pakai aku bodong tertawa gueeee lucu kamu,1
keren suara super merdu coba ikut audisi nyanyi pasti bakat bisa salur,0
jedar memang muka 2 kali di depan baik di belakang busuk mulut kayak banci cucoklah 2 banci itu,1
joget bikin ngakakkk anjir kampung banget nama nama,1
bagi suara pas banget pecah suara juga cakap,0
keren min orang orang yang bakat kayak begini yang harus di up ke publik,0
kereeeeeeeeeeeeeeennn sampai merinding brrrrr,0
ibu tiri hebat nanti paling kalau sudah 20an dia baru awat sekarang masih muda kasihan kalau di paksa awat cuma ya paling tutup mata tutup kuping sekarang adalah,0
untung banget deh mbak nama dapat mas nama ganteng baik saleh sayang keluarga ini suami idam banget moga selalu jadi keluarga yang samawa,0
lagu baru mbak tata kan kisah nyata rumah tangga mbak tata jadi rasa mbak tata benar benar sayang get sama suami syukur kalau baik moga awet,0
anak babi bangsat ingin sumpel timah panas ke congor kamu biar modar,1
gagal fokus dengar suara kok jengkel ya dengar maaf cuma manusia biasa kalau jengkel,1
ah min gue lama lama tidak suka sama akun ini nih berita nya basi kamu lihat dong min itu sih kalian sama amora lagi datang pakai ikut jingkrak2 kok kamu saring dulu dong min biar berita nya tidak blunder kamu posting juga itu kd sudah posting videon kalian sama amora lagi joget2 sama sih arsya arsyi,1
respect dengan istri dan anak anak nya yang tunggu dengan sabar di rumah insya allah allah subhanahu wa taala selalu jaga nya,0
yang nama nya plagiat ya plagiat walaupun laku tetapi tetap saja cipta dari hasil plagiat wkwk gue adalah ogah dwngerin saja sudah ingin muntah,1
mami depe cantik banget awet muda tidak kalah sama nyanyi datang baru moga samawa nama,0
mending lihat dek molen biarpun cowok tetapi cantik tidak kayak ini cewek tetapi malah kayak bencong wkwk,1
mereka hanya cari rejeki untuk keluarga kalau ada yang rasa tidak kenan tolong jangan guna keras,0
kasihan ih cari uang sampai begitu,1
yea pak polisi pintar haha langsung belok sim tembak tak tau rambu2 malah minta surat perintah yaelah kamu pikir rumah kamu mau geledah,0
anjir tonton yang sangat tidak mutu,1
memang dasar sih anak nya saja yang lebay urus pribadi di umbar biar di blow up aduh guna whatsapp sms orang telepon buat apa suka aneh,1
bicara saja lepot banyak gaya kamu bencong,1
bu ameeel sudah lama tidak ke bank kangen bu amel yang cantik ramah baik sama kangen tenteng hihiii tanya sih mbak bu amelnya pindah rumah dan lagi hamil sehat sehat ya bu amel salam buat annabel,0
asyik banget dancenya apa lagi lagu mancappppp,0
amazing banget miss nasional costume keren bangga sama budaya indonesia,0
heran deh yang maki sih via bawa asa ya wajar lah dese bawa asa karena udin muak sama orang yang munafik sok an baik sama dese lah apa kabar yang sering bawa asa sama laki orang tidak pada sadar diri itu puja att bukan pada gotong royong buat nasihat att ini malah gila buat muja att dan mojokin viaa dese juga manusia kali ah,1
ya ampun cantik banget asli angguunn,0
najiiisss kayak sih mbak dese tidak begitu saja haha maling teriak maling kaca buuuuuk,1
moga betul kalau sama yang ini mah kalau bella mah sudah dapat yang amat sangat pas lah,0
wah ini mah pe emuan buah ranum dan buah busuk sudah tau dong yang busuk yang manah mentok2nya adalah begitu saja kalau rebut laki orang,1
sikat habis lah orng2 sial kayak begini pimpin negara sendiri tidak di hormat jangan mentang mentang bapak presiden kita terlalu baik jadi di sembarangin saya marah tidak boleh kita hina pimpin kita sendiri saya harap segera di tindak hukum orang ini,1
mungkin si mbak nya marah marah karena ada kata kata yang tidak enak dari yang komen wajar lah kalau dia marah toh it kan cuma foto biasa saja kok jadi malah mbak nya yang di bully sampai bawa bawa fisik segala kan tidak bagus pintar pintar lah kita mnyikapi media sosial,0
senang lihat ibu dan bapak susilo bambang yudhoyono nikmat hari tua sama cucu cinta sehat terus ya memo dan pepo allah subhanahu wa taala lindung memo dan pepo dan keluarga kisss,0
dulu inul goyang ngebor baju ketat dcekal harus nya nih juga dengan sgja goyang dada mulu suara tidak sbrpa mrsk moral anak muda yang nonton bawa nafsu saja nanti,1
banyak banget emas jadi salpok emas tetapi sumpah lagu dan musik nya keren bngat apalagi konsep video musik nya ia ambil handel kan keren turut saya kalau denada taro kutang di luar itu karena masih minim perestasi tetapi kalau agnes itu hal wajar prestasi dan dunia fashion kalau a is indonesia ia selalu unggul karena ia berani meski tidak cocok ia pakai,0
